_id,listPrice,desc,name
J5024,98,"The 484 is our slimmest fit yet, for guys who like their jeans tailored, not skinny. Cut from fabric from Kurabo, the supplier to Japan's first-ever denim brand, this pair has stretch for the guy who walks or bikes everywhere. They've still got an authentic, raw-denim look, while being super soft and comfortable—if you didn't think slim-fitting jeans were for you, this is the pair that's flexible enough to change your mind.",484 Slim-fit jean in stretch resin rinse Japanese denim
BE613,128,"Our designers are obsessed with denim—and it shows. We source denim from some of the world's most renowned mills, create exclusive washes and build our jeans to feel good from the moment you put them on. This denim comes from the legendary Cone mill and is made with 100 percent cotton, so it will take on your unique wear characteristics over time. Our newest washes let you jump into the break-in process wherever you like, from day-one dark to old-favorite fades. By buying cotton products from J.Crew, you're supporting our investment in Better Cotton's mission to help cotton communities survive and thrive while protecting and restoring the environment. This product is sourced through a system of mass balance and therefore may not contain Better Cotton.",484 Slim-fit jean in three-year-wash
BO850,148,"Our designers are obsessed with denim - and it shows. We source denim from some of the world's most renowned mills, create exclusive washes and build our jeans to feel good from the moment you put them on. This denim is made with stretch, so it will be comfortable for all-day wear. By buying cotton products from J.Crew, you're supporting our investment in Better Cotton's mission to help cotton communities survive and thrive while protecting and restoring the environment. This product is sourced through a system of mass balance and therefore may not contain Better Cotton.",484 Slim-fit stretch jean in medium wash
AU662,128,"Our designers are obsessed with denim—and it shows. We source denim from some of the world's most renowned mills, create exclusive washes and build our jeans to feel good from the moment you put them on. This denim comes from the legendary Cone mill and is made with 100 percent cotton, so it will take on your unique wear characteristics over time. Our newest washes let you jump into the break-in process wherever you like, from day-one dark to old-favorite fades. By buying cotton products from J.Crew, you're supporting more responsibly grown cotton through the Better Cotton Initiative.",770™ Straight-fit jean in five-year wash
BI524,128,"Our designers are obsessed with denim—and it shows. We source denim from some of the world's most renowned mills, create exclusive washes and build our jeans to feel good from the moment you put them on. This denim is made with cotton and a touch of stretch, so it will take on your unique wear characteristics over time. By buying cotton products from J.Crew, you're supporting our investment in Better Cotton's mission to help cotton communities survive and thrive while protecting and restoring the environment. This product is sourced through a system of mass balance and therefore may not contain Better Cotton.",770™ Straight-fit stretch jean in five-year wash
AW296,128,"Our designers are obsessed with denim—and it shows. We source denim from some of the world's most renowned mills, create exclusive washes and build our jeans to feel good from the moment you put them on. These jeans are easy to move in thanks to denim with just the right amount of Stretch on Demand. Our newest washes let you jump into the break-in process wherever you like, from day-one dark to old-favorite fades. By buying cotton products from J.Crew, you're supporting more responsibly grown cotton through the Better Cotton Initiative.",770™ Straight-fit stretch jean in three-year wash
BK293,98,"Softer and lighter than denim (thanks to a different weaving process), chambray looks great no matter how you wear it. We designed this shirt in a more roomy, traditional cut and gave it a spread collar, so that it can be dressed up, dressed down, layered—you get the idea.",Bowery chambray shirt with spread collar
BN130,128,"A premium edition of our best-selling Ludlow dress shirt, designed and crafted for your sharpest days. Woven with fine two-ply 100s yarns in 100 percent cotton for a silky finish and lighter feel, this shirt has all the details you know and love about our Ludlow dress shirt - like a french placket, plus a tailored collar and sleeve sizes. Wear our finest dress shirt with Ludlow pants or a full Ludlow suit for work, weddings and everywhere in between.",Ludlow Premium fine cotton dress shirt with french cuffs
BM493,128,"Introducing a premium edition of our best-selling Ludlow dress shirt, designed and crafted for your sharpest days. Woven with fine two-ply 100s yarns in 100 percent cotton for a silky finish and lighter feel, this shirt has all the details you know and love about our Ludlow dress shirt - like a french placket and tailored collar and sleeve sizes. Wear our finest dress shirt with Ludlow pants or a full Ludlow suit for work, weddings and everywhere in between. A tailored fit, cut slim through the body and sleeves.",Ludlow Premium fine cotton dress shirt
AI873,128,"Introducing a premium edition of our bestselling Ludlow dress shirt, designed and crafted for your sharpest days. Woven with fine two-ply 100s yarns in 100 percent cotton for a silky finish and lighter feel, this shirt has all the details you know and love about our Ludlow dress shirt—like a French placket and tailored collar and sleeve sizes. Wear our finest dress shirt with Ludlow pants or a full Ludlow suit for work, weddings and everywhere in between.",Slim-fit Ludlow Premium fine cotton dress shirt in dobby
M9487,240,"Darryl Brown takes a modern approach in designing workwear, stemming from Darryl Brown's life experience as an engineer, surrounded by engineers. His day to day in the blue-collar, nine-to-five lifestyle led to Darryl Brown's authenticity and clear alignment with its true consumers. Reminiscent of the Midwest working man, very cozy.",Darryl Brown™ DB flannel shirt
M0012,90,"Made from supersoft mercerized cotton, this classic undershirt comes in a fuller cut and longer length for an extra-comfy fit. The flat seams at the crewneck and hem make this a no-brainer layering piece under pretty much anything. Minimalist and modern, HANRO is a luxe undergarments label that has been crafting refreshingly simple designs from premium materials (aka not-so-basic basics) for over 100 years.",HANRO® cotton sporty short-sleeve crewneck T-shirt
AT380,79.5,"Originally developed in the early 1900s, the double-layer fabric of this pant traps heat, making it ideal for layering. In fact, this style of duo-knit fabric was worn by the first Everest expedition to reach the summit.",Double-knit jogger lounge pant
BB876,69.5,"Your go-to pant for hanging out, walking the dog or watching the game. Or, you know. . .sleeping.",Flannel pajama pant in print
BH935,59.5,"Your go-to pant for hanging out, walking the dog or watching the game. Or, you know...sleeping.",Pajama pant in printed cotton poplin
N0146,94,"Petite Plume was inspired by the desire to create sophisticated and comfortable sleepwear in the most exquisite cotton available. With Petite Plume, your family will be tucked in love and off to dreamland. Bonne nuit. This classic pajama set is accented with piping and finished with pearl buttons. The fabric is made from 100 percent of the finest-quality cotton. It is yarn-dyed to prevent fading and brushed for added softness, making the sleepwear feel absolutely luxurious, getting cozier after each wash.",Petite Plume™ men's classic flannel pajama set
N2588,78,"Petite Plume was inspired by the desire to create sophisticated and comfortable sleepwear in the most exquisite fabrics available. With Petite Plume, your family will be tucked in love and off to dreamland. Bonne nuit. This classic pajama set is accented with pearl buttons. The fabric is made from 100 percent of the finest-quality cotton. It is yarn-dyed to prevent fade and brushed for added softness, making the sleepwear feel absolutely luxurious, getting cozier after each wash.",Petite Plume™ men's short set with piping
AZ595,59.5,"Your go-to pj shirt for hanging out, walking the dog or watching the game. Or sleeping.",Pajama shirt in cotton poplin
N0151,94,"Petite Plume was inspired by the desire to create sophisticated and comfortable sleepwear in the most exquisite cotton available. With Petite Plume, your family will be tucked in love and off to dreamland. Bonne nuit. This elegant robe is the perfect addition to our collection. The classic palette is a staple and will have you looking smart in no time. The fabric is made from 100 percent of the finest-quality cotton. It is yarn-dyed to prevent fading and brushed for added softness, making the sleepwear feel absolutely luxurious, getting cozier after each wash.",Petite Plume™ men's flannel robe
N0187,118,"Petite Plume was inspired by the desire to create sophisticated and comfortable sleepwear in the most exquisite cotton available. With Petite Plume, your family will be tucked in love and off to dreamland. Bonne nuit. Buttery and smooth, yet breathable, this collection is yarn-dyed to prevent fading and is destined to become a fixture of your soothing bedtime ritual. The pièce de résistance of pajamas: the perfect, supple, luxury Pima robe. Length falls below the knee for ease of movement and includes all the lovely details (chic piping on the cuffs, a generous sash) that grace our classic pajama silhouettes.",Petite Plume™ men's luxe Pima cotton robe
N0181,128,"Petite Plume was inspired by the desire to create sophisticated and comfortable sleepwear in the most exquisite cotton available. With Petite Plume, your family will be tucked in love and off to dreamland. Bonne nuit. Buttery and smooth, yet breathable, this collection is yarn-dyed to prevent fading and is destined to become a fixture of your soothing bedtime ritual. The pièce de résistance of pajamas: the perfect, supple, luxury Pima robe. Length falls below the knee for ease of movement and includes all the lovely details (chic piping on the cuffs, a generous sash) that grace our classic pajama silhouettes.",Petite Plume™ men's Pima cotton robe in pinstripe
AV209,89.5,"Our world-famous stretch chinos (aka khakis) are customer favorites for a reason—several, actually. Our designers engineer these pants with precision—using fit and fabric detail that'll make you want to wear them every day. We use just the right amount of Stretch on Demand for extra flex you'll only notice when you need it. Custom striped yarn-dyed pocket bags and an old-school coin pocket at the right hip are functional touches that just look great too. Our designers painstakingly calibrate the pitch of the pants (aka the difference between the rise in the front and back) to ensure you get a comfortable fit, every time.",1040 Athletic tapered-fit stretch chino pant
AX689,98,"Designed to take you everywhere from an early tee time to the office to dinner, our tech pants are crafted with performance fabric to keep you cool, dry and comfortable. We've updated them with an interior elastic panel at the back waistband for the perfect fit, plus a silicone shirt gripper to keep everything in place when you're on the go. Breathable mesh pockets plus a hidden zip pocket means you'll have plenty of room to store your essentials during your active(ish) schedule. By buying cotton products from J.Crew, you're supporting more responsibly grown cotton through the Better Cotton Initiative.",1040 Athletic tapered-fit tech pant
AR886,89.5,"Our world-famous stretch chinos (aka khakis) are customer favorites for a reason—several, actually. Our designers engineer these pants with precision—using fit and fabric detail that'll make you want to wear them every day. We use just the right amount of Stretch on Demand for extra flex you'll only notice when you need it. Custom striped yarn-dyed pocket bags and an old-school coin pocket at the right hip are functional touches that just look great too. Our designers painstakingly calibrate the pitch of the pants (aka the difference between the rise in the front and back) to ensure you get a comfortable fit, every time.",770™ Straight-fit stretch chino pant
BI768,175,"Carhartt has been making workwear that stands the test of time since 1889 and through its Work in Progress division, has acquired major street-style cred in recent years. These versatile cargo pants are built in sturdy cotton canvas with double-knee panels for extra durability.",Carhartt® Work in Progress Keyto cargo pant
M9492,150,"Darryl Brown takes a modern approach in designing workwear, stemming from Darryl Brown's life experience as an engineer, surrounded by engineers. His day to day in the blue-collar, nine-to-five lifestyle led to Darryl Brown's authenticity and clear alignment with its true consumers. Perfect for all occasions.",Darryl Brown™ DB trouser pant
BJ501,138,"Introducing the Giant-fit chino, our widest fit, back from the '90s and updated with modern details like a longer rise, plenty of space through the hip and thigh and a 20 1/2"" leg opening with a sewn cuff. This revamped version utilizes midweight 8.5-ounce 100% cotton twill that's stone-and-enzyme washed, resulting in a finish that's just soft enough to feel lived-in right from the first wear. We embroidered this version with nautical nods to J. Crew's heritage. By buying cotton products from J.Crew, you're supporting our investment in Better Cotton's mission to help cotton communities survive and thrive while protecting and restoring the environment. This product is sourced through a system of mass balance and therefore may not contain Better Cotton",Giant-fit chino pant in embroidered canoe
BO997,168,"Wallace & Barnes is our exclusive collection of rugged essentials inspired by traditional workwear, military surplus, vintage uniforms and classic outdoor gear. Built in hard-wearing denim with double knee panels, these carpenter pants are modeled after rugged, classic pairs with a long-standing history in workwear.",Wallace & Barnes herringbone carpenter pant
G7137,98,"You won't get mistaken for your old English professor in our super-soft corduroys thanks to their thin 14-wale fabric. Fun fact: The word ""wale,"" which refers to the peaks in a corduroy fabric, comes from an old Anglo-Saxon word for the ridges in a ploughed field.",770™ Straight-fit pant in corduroy
BI532,98,"You won't get mistaken for your old English professor in our supersoft corduroys, thanks to their 15-wale fabric. These corduroy pants, a fall classic, are destined to earn a spot in your regular rotation. The Classic Straight-fit is modeled after vintage denim from the 1950s and made with a true straight leg and slightly longer rise. Fun fact: The word ""wale,"" which refers to the peaks in a corduroy fabric, comes from an old Anglo-Saxon word for the ridges in a ploughed field.",Classic Straight-fit pant in stretch corduroy
BE458,98,"These versatile pants are made with cotton and linen for breathability and texture, and look great no matter how you wear them. Our designers engineer these pants with precision—using fit and fabric details that'll make you want to wear them every day. We use just the right amount of Stretch on Demand for extra flex you'll only notice when you need it. Our designers painstakingly calibrate the pitch of the pants (aka the difference between the rise in the front and back) to ensure you get a comfortable fit, every time.",770™ Straight-fit chino pant in stretch slub cotton-linen
BG235,178,"Based in the Harajuku district of Tokyo, BEAMS PLUS has been designing distinctive, heritage-inspired styles since it was founded in 1999 by Beams, one of Japan's most admired lifestyle retailers. BEAMS PLUS creates original pieces that draw from authentic Americana style, bringing these timeless designs to a new generation. This polo is made in Japan with fine cotton, and features retro stripes for an old-school look.",BEAMS PLUS polo shirt in jacquard stripe
BE870,79.5,"The classic polo shirt you know and love is back. Named after the horseback sport, the polo shirt as we know it was introduced in the 1930s for wear on the tennis court. Knit in a traditional piqué cotton for subtle texture and ease of movement, this is an easy, comfortable choice whether you're hitting the links or heading to brunch. By buying cotton products from J.Crew, you're supporting our investment in Better Cotton's mission to help cotton communities survive and thrive while protecting and restoring the environment. This product is sourced through a system of mass balance and therefore may not contain Better Cotton.",Classic piqué polo shirt
BQ003,45,"These supersoft polos are made from garment-dyed slub cotton, which means each one will have a rich, perfectly imperfect color that will softly fade over time.",Garment-dyed johnny-collar polo shirt in tipped slub cotton
J1851,45,"These supersoft polos are made from garment-dyed slub cotton, which means each one will have a rich, perfectly imperfect color that will softly fade over time.",Garment-dyed slub cotton pocket polo shirt
AI946,49.5,"This supersoft polo is made from slightly textured slub cotton. We dye each shirt after it's sewn to give it a rich, perfectly imperfect color, with highs and lows at the seams.",Slub cotton polo shirt in yarn-dyed stripe
BN365,69.5,"Our designers updated the classic piqué polo in a soft, breathable cotton blend with COOLMAX technology that wicks away moisture and provides UPF 50+ sun protection so you're comfortable all day (and night). Plus, the built-in stretch moves with you whether you're around town, playing golf or just heading out for a neighborhood stroll.",Performance polo shirt with COOLMAX®
BQ077,98,"The rugby shirt, invented with its namesake sport in the 19th century and perfected by our own designers in the 1980s, is made with 11-ounce cotton jersey and the traditional rubber buttons like the ones you wore years ago. You'll also find a canvas collar, twill taping at the placket, reinforced elbow patches for durability and a relaxed fit that's easy to wear. By buying cotton products from J.Crew, you're supporting our investment in Better Cotton's mission to help cotton communities survive and thrive while protecting and restoring the environment. This product is sourced through a system of mass balance and therefore may not contain Better Cotton.",Rugby shirt in colorblock
BJ208,98,"The rugby shirt, invented with its namesake sport in the 19th century and perfected by our own designers in the 1980s, is made with 11-ounce cotton jersey and the traditional rubber buttons like the ones you wore years ago. You'll also find a canvas collar, twill taping at the placket, reinforced elbow patches for durability and a relaxed fit that's easy to wear. By buying cotton products from J.Crew, you're supporting our investment in Better Cotton's mission to help cotton communities survive and thrive while protecting and restoring the environment. This product is sourced through a system of mass balance and therefore may not contain Better Cotton.",Rugby shirt in stripe
BN429,98,"The rugby shirt, invented with its namesake sport in the 19th century and perfected by our own designers in the 1980s, is made with 11-ounce cotton jersey and the traditional rubber buttons like the ones you wore years ago. You'll also find a canvas collar, twill taping at the placket, reinforced elbow patches for durability and a relaxed fit that's easy to wear. By buying cotton products from J.Crew, you're supporting our investment in Better Cotton's mission to help cotton communities survive and thrive while protecting and restoring the environment. This product is sourced through a system of mass balance and therefore may not contain Better Cotton.",Rugby shirt in stripe
BN481,198,"When it comes to quality and color, no one does cashmere quite like we do. Our best-selling and crazy-soft sweaters are the result of over 30 years of expertise, obsessing over fit, durability and handfeel. The result? They're soft and warm, while still being lightweight, which means they're perfect to layer underneath a jacket now or to wear on their own later. We're proud to support responsible cashmere production through our partnership with the Aid by Trade Foundation (AbTF), a nonprofit that promotes sustainable agricultural development across the globe. As the foundation's first U.S. member, we source cashmere that is certified to the AbTF's The Good Cashmere Standard®, which ensures the welfare of the cashmere goats, protects natural resources and improves the working conditions of farmers and farmworkers in Inner Mongolia.",Limited-edition cashmere short-sleeve johnny-collar sweater in stripe
BM381,198,"Based in the Harajuku district of Tokyo, BEAMS PLUS has been designing distinctive, heritage-inspired styles since it was founded in 1999 by BEAMS, one of Japan's most admired lifestyle retailers. BEAMS PLUS creates original pieces that draw from authentic Americana style, bringing these timeless designs to a new generation. Our exclusive collection combines and plays with prep and uniform aesthetics, which results in familiar-yet-unique pieces. This cotton twill rugger shirt is based on a military-issue pullover utility shirt from the '70s. The contrast-color panels are all within the military palette, making it wearable and not too loud.",BEAMS PLUS X J.Crew rugger shirt
BF796,69.5,"The oxford-cloth button-down shirt is a quintessential wardrobe staple and a hallmark of old-school collegiate style. Our Broken-in oxford is made from soft organic cotton that's been washed to feel like an old favorite right from the jump. It's lightweight and comfortable, with a casual feel that nods to its Ivy League heritage. (Fun fact: Yale, Harvard and Cambridge also had shirt fabrics named after them, but none have stood the test of time as well as Oxford's.) Organic cotton is grown without toxic chemicals or GMOs (genetically modified organisms), which means it's better for the health of the soil, the ecosystem and the people who farm it.",Short-sleeve garment dyed Broken-in oxford shirt
BJ463,79.5,"Meet your work-to-weekend-to-wherever shirt for cooler temps. Crafted from a supersoft brushed twill (aka flannel's lighter-weight cousin), this shirt is cut to be more polished than a rugged, heavier workshirt. That gives this button-down all the versatility of our best-selling Secret Wash shirts, so it's ready to wear under a blazer or over a vintage tee.",Brushed twill shirt
BK220,118,"Based on traditional workwear styles, our heaviest denim shirt is ready to take on everything you can throw at it. It's also surprisingly versatile, so you can dress it up or down depending on what's on your agenda. Either way, expect this to be your new go-to. Dyed with real indigo, this shirt will look better as it breaks in over time and gently fade the more you wear it, just like your favorite jeans.",Heavyweight 10 oz. denim workshirt
BN627,89.5,"Softer and lighter than denim (thanks to a different weaving process), chambray looks great no matter how you wear it. Our newest washes also let you jump into the break-in process wherever you like, from day-one dark to old-favorite fades. We make this workwear-inspired staple in organic cotton that's grown without toxic chemicals or GMOs (genetically modified organisms), which means it's better for the health of the soil, the ecosystem and the people who farm it. Fun fact: The term ""chambray"" comes from Cambrai, the region in northern France where the fabric was born.",Organic cotton indigo chambray shirt in plaid
BE164,69.5,"Softer and lighter than denim (thanks to a different weaving process), chambray looks great no matter how you wear it. This shirt is a versatile piece that can be dressed up, dressed down, layered—you get the idea. We weave this chambray shirt in organic cotton that's grown without toxic chemicals or GMOs (genetically modified organisms), which means it's better for the health of the soil, the ecosystem and the people who farm it. Fun fact: The term chambray comes from Cambrai, the region in northern France where the fabric was born.",Short-sleeve indigo organic chambray shirt
BE320,148,"Wallace & Barnes is our exclusive collection of modern, rugged essentials inspired by traditional workwear, old military uniforms and classic outdoor gear. Made with 100 percent cotton selvedge chambray that we sourced from Japan, this versatile workshirt looks as good with denim as it does with chinos. In addition to its two buttoned pockets, this vintage-inspired shirt features authentic details like reinforcement from the elbow to the cuff.",Wallace & Barnes naval workshirt in Japanese selvedge chambray
BN632,148,"Wallace & Barnes is our exclusive collection of rugged essentials inspired by traditional workwear, military surplus, vintage uniforms and classic outdoor gear. This versatile, warm-weather classic is made with 100 percent cotton selvedge chambray that we sourced from Japan. ""Selvedge"" refers to the self-finished edge of a piece of fabric, a tightly woven band that keeps the hem from unraveling and fraying.",Wallace & Barnes naval workshirt in Japanese selvedge chambray
BJ445,168,"This shirt is tailored in soft cotton flannel from Thomas Mason, one of Europe's oldest and most legendary mills (it's been weaving some of the world's finest cloth since 1796 and working with us since 2008). Consider this the elevated version of your usual fall flannel—it looks as good on its own as it does paired with a blazer.",Thomas Mason® for J.Crew melange flannel shirt
